{
  "$schema": "../schemas/form.schema.json",
  "schemaVersion": 1,
  "id": "setup-identity",
  "version": 1,
  "title": "Plugin identity setup",
  "description": "Questions npm run setup asks in a terminal. Field ids are the --answers keys and option names; scripts/setup/form.mjs reads only text and confirm fields. Enter keeps the current value, which setup validates and reviews before writing.",
  "fields": [
    { "id": "id", "kind": "text", "label": "Plugin ID", "help": "Portable plugin id: a lowercase letter, then lowercase letters, digits and single hyphens (at most 64 characters)." },
    { "id": "name", "kind": "text", "label": "Plugin name", "help": "Display name shown in the host, at most 80 characters." },
    { "id": "description", "kind": "text", "label": "Description", "help": "One-line plugin description, at most 300 characters." },
    { "id": "author", "kind": "text", "label": "Author", "help": "Author name, at most 120 characters." },
    { "id": "repo", "kind": "text", "label": "GitHub repository", "help": "Optional owner/name, without a URL, .git suffix or credentials." },
    { "id": "version", "kind": "text", "label": "Version", "help": "Explicit stable x.y.z version." },
    { "id": "mcp", "kind": "confirm", "label": "Enable project-local Workbench MCP for Claude Code and Codex?",
      "help": "Writes repository-local client settings only; installs no client. Not asked when --mcp, --no-mcp or an mcp answer was supplied." }
  ]
}
