{
  "$schema": "../schemas/form.schema.json",
  "schemaVersion": 1,
  "id": "fake-data-run",
  "version": 1,
  "title": "Fake data run",
  "description": "Amount, target folder, seed and optional Obsidian Bases file of one seeded generation. The same seed always produces the same notes.",
  "fields": [
    { "id": "count", "kind": "number", "label": "How many notes?", "integer": true, "min": 1, "max": 1000, "default": 10 },
    { "id": "out", "kind": "text", "label": "Target folder (relative to the project root)", "required": true, "maxLength": 160 },
    { "id": "seed", "kind": "number", "label": "Seed (same seed, same notes)", "integer": true, "min": 0, "max": 2147483647, "default": 1 },
    { "id": "base", "kind": "boolean", "label": "Add an Obsidian Bases table (.base) for the collection?", "default": true }
  ]
}
